[I 2024-01-05 18:17:21,112] Trial 150 finished with value: 0.8560987976146294 and parameters: {'n_estimators': 158, 'max_depth': 22, 'min_samples_split': 0.035880856208011715, 'min_samples_leaf': 0.026344113205620107, 'max_features': 'log2'}. Best is trial 142 with value: 0.8632902223707207.
[I 2024-01-05 18:17:55,586] Trial 151 finished with value: 0.8615491042014108 and parameters: {'n_estimators': 137, 'max_depth': 18, 'min_samples_split': 0.04083282898088788, 'min_samples_leaf': 0.010160093908962338, 'max_features': 'log2'}. Best is trial 142 with value: 0.8632902223707207.
[I 2024-01-05 18:18:14,686] Trial 152 finished with value: 0.8440449421075623 and parameters: {'n_estimators': 130, 'max_depth': 21, 'min_samples_split': 0.22607216484913883, 'min_samples_leaf': 0.018354300401027604, 'max_features': 'log2'}. Best is trial 142 with value: 0.8632902223707207.
[I 2024-01-05 18:18:51,985] Trial 153 finished with value: 0.8573864417980902 and parameters: {'n_estimators': 152, 'max_depth': 21, 'min_samples_split': 0.038860453073842186, 'min_samples_leaf': 0.014111124207198296, 'max_features': 'log2'}. Best is trial 142 with value: 0.8632902223707207.
[I 2024-01-05 18:19:23,252] Trial 154 finished with value: 0.8630949215337559 and parameters: {'n_estimators': 117, 'max_depth': 18, 'min_samples_split': 0.02698871786070156, 'min_samples_leaf': 0.010074038664150154, 'max_features': 'log2'}. Best is trial 142 with value: 0.8632902223707207.
[I 2024-01-05 18:19:47,292] Trial 155 finished with value: 0.8566909853893312 and parameters: {'n_estimators': 102, 'max_depth': 18, 'min_samples_split': 0.023703393546783837, 'min_samples_leaf': 0.021157269055318423, 'max_features': 'log2'}. Best is trial 142 with value: 0.8632902223707207.
[I 2024-01-05 18:20:13,823] Trial 156 finished with value: 0.8561979658439716 and parameters: {'n_estimators': 119, 'max_depth': 18, 'min_samples_split': 0.03259503060091669, 'min_samples_leaf': 0.026465227688009164, 'max_features': 'log2'}. Best is trial 142 with value: 0.8632902223707207.
[I 2024-01-05 18:20:51,167] Trial 157 finished with value: 0.863887350455934 and parameters: {'n_estimators': 136, 'max_depth': 19, 'min_samples_split': 0.015328150931271796, 'min_samples_leaf': 0.01014207189870434, 'max_features': 'log2'}. Best is trial 157 with value: 0.863887350455934.
[I 2024-01-05 18:21:17,007] Trial 158 finished with value: 0.8536559360995859 and parameters: {'n_estimators': 131, 'max_depth': 20, 'min_samples_split': 0.014085416861403443, 'min_samples_leaf': 0.0379448221921754, 'max_features': 'log2'}. Best is trial 157 with value: 0.863887350455934.
[I 2024-01-05 18:21:48,519] Trial 159 finished with value: 0.8634388166315368 and parameters: {'n_estimators': 113, 'max_depth': 19, 'min_samples_split': 0.017967645409871964, 'min_samples_leaf': 0.010170223290083056, 'max_features': 'log2'}. Best is trial 157 with value: 0.863887350455934.
[I 2024-01-05 18:22:15,029] Trial 160 finished with value: 0.8568447865650235 and parameters: {'n_estimators': 109, 'max_depth': 19, 'min_samples_split': 0.018506718487798668, 'min_samples_leaf': 0.01968549716868187, 'max_features': 'log2'}. Best is trial 157 with value: 0.863887350455934.
[I 2024-01-05 18:22:48,343] Trial 161 finished with value: 0.8583354328878021 and parameters: {'n_estimators': 130, 'max_depth': 20, 'min_samples_split': 0.02508780280400956, 'min_samples_leaf': 0.014903998971398448, 'max_features': 'log2'}. Best is trial 157 with value: 0.863887350455934.
[I 2024-01-05 18:23:22,534] Trial 162 finished with value: 0.8628262644838929 and parameters: {'n_estimators': 124, 'max_depth': 19, 'min_samples_split': 0.010908093852871104, 'min_samples_leaf': 0.010498091627961184, 'max_features': 'log2'}. Best is trial 157 with value: 0.863887350455934.
[I 2024-01-05 18:23:52,049] Trial 163 finished with value: 0.8571498456388283 and parameters: {'n_estimators': 122, 'max_depth': 20, 'min_samples_split': 0.01487470287436582, 'min_samples_leaf': 0.018998658045936374, 'max_features': 'log2'}. Best is trial 157 with value: 0.863887350455934.
[I 2024-01-05 18:24:22,502] Trial 164 finished with value: 0.856515441633379 and parameters: {'n_estimators': 135, 'max_depth': 19, 'min_samples_split': 0.012242619442050207, 'min_samples_leaf': 0.02498564628380981, 'max_features': 'log2'}. Best is trial 157 with value: 0.863887350455934.
[I 2024-01-05 18:24:50,549] Trial 165 finished with value: 0.8582440033104095 and parameters: {'n_estimators': 110, 'max_depth': 19, 'min_samples_split': 0.010151354530043918, 'min_samples_leaf': 0.014916148424764564, 'max_features': 'log2'}. Best is trial 157 with value: 0.863887350455934.
[I 2024-01-05 18:25:24,082] Trial 166 finished with value: 0.8637073076248937 and parameters: {'n_estimators': 122, 'max_depth': 18, 'min_samples_split': 0.018567658950072532, 'min_samples_leaf': 0.010156486869583184, 'max_features': 'log2'}. Best is trial 157 with value: 0.863887350455934.
[I 2024-01-05 18:25:50,151] Trial 167 finished with value: 0.8546179815939775 and parameters: {'n_estimators': 126, 'max_depth': 18, 'min_samples_split': 0.01872736236837867, 'min_samples_leaf': 0.03196168971530344, 'max_features': 'log2'}. Best is trial 157 with value: 0.863887350455934.
[I 2024-01-05 18:26:16,819] Trial 168 finished with value: 0.8566403035688323 and parameters: {'n_estimators': 112, 'max_depth': 18, 'min_samples_split': 0.023521345653424973, 'min_samples_leaf': 0.02071095934229486, 'max_features': 'log2'}. Best is trial 157 with value: 0.863887350455934.
[I 2024-01-05 18:26:57,634] Trial 169 finished with value: 0.8634251912696731 and parameters: {'n_estimators': 154, 'max_depth': 21, 'min_samples_split': 0.029388957919507984, 'min_samples_leaf': 0.010806450109245858, 'max_features': 'log2'}. Best is trial 157 with value: 0.863887350455934.
[I 2024-01-05 18:27:35,747] Trial 170 finished with value: 0.8576607390336537 and parameters: {'n_estimators': 155, 'max_depth': 21, 'min_samples_split': 0.0189423793906944, 'min_samples_leaf': 0.01676273022586791, 'max_features': 'log2'}. Best is trial 157 with value: 0.863887350455934.
[I 2024-01-05 18:28:11,940] Trial 171 finished with value: 0.8622572094156109 and parameters: {'n_estimators': 137, 'max_depth': 19, 'min_samples_split': 0.028593544745523766, 'min_samples_leaf': 0.01038340614916862, 'max_features': 'log2'}. Best is trial 157 with value: 0.863887350455934.
[I 2024-01-05 18:28:46,900] Trial 172 finished with value: 0.8582431132643904 and parameters: {'n_estimators': 139, 'max_depth': 23, 'min_samples_split': 0.029044221412641322, 'min_samples_leaf': 0.015686681411677224, 'max_features': 'log2'}. Best is trial 157 with value: 0.863887350455934.
[I 2024-01-05 18:29:31,629] Trial 173 finished with value: 0.8626340278169515 and parameters: {'n_estimators': 168, 'max_depth': 20, 'min_samples_split': 0.027967786873719588, 'min_samples_leaf': 0.010087135235429884, 'max_features': 'log2'}. Best is trial 157 with value: 0.863887350455934.
[I 2024-01-05 18:30:12,296] Trial 174 finished with value: 0.85602676720106 and parameters: {'n_estimators': 179, 'max_depth': 20, 'min_samples_split': 0.010301399025934577, 'min_samples_leaf': 0.02365717435798761, 'max_features': 'log2'}. Best is trial 157 with value: 0.863887350455934.
[I 2024-01-05 18:30:53,483] Trial 175 finished with value: 0.8580441416595541 and parameters: {'n_estimators': 167, 'max_depth': 22, 'min_samples_split': 0.027817364132654013, 'min_samples_leaf': 0.016388124737825756, 'max_features': 'log2'}. Best is trial 157 with value: 0.863887350455934.
[I 2024-01-05 18:31:34,847] Trial 176 finished with value: 0.864021128929114 and parameters: {'n_estimators': 150, 'max_depth': 20, 'min_samples_split': 0.020887926547038263, 'min_samples_leaf': 0.010149500157697836, 'max_features': 'log2'}. Best is trial 176 with value: 0.864021128929114.
[I 2024-01-05 18:32:01,383] Trial 177 finished with value: 0.8565198130708598 and parameters: {'n_estimators': 118, 'max_depth': 20, 'min_samples_split': 0.020162421168951023, 'min_samples_leaf': 0.024811146368091293, 'max_features': 'log2'}. Best is trial 176 with value: 0.864021128929114.
[I 2024-01-05 18:32:48,630] Trial 178 finished with value: 0.7767218397827671 and parameters: {'n_estimators': 151, 'max_depth': 19, 'min_samples_split': 0.015528003947308508, 'min_samples_leaf': 0.11384589494450117, 'max_features': None}. Best is trial 176 with value: 0.864021128929114.
[I 2024-01-05 18:33:26,696] Trial 179 finished with value: 0.8566959497368801 and parameters: {'n_estimators': 161, 'max_depth': 21, 'min_samples_split': 0.023790462992496833, 'min_samples_leaf': 0.020680011368679654, 'max_features': 'log2'}. Best is trial 176 with value: 0.864021128929114.
[I 2024-01-05 18:33:53,076] Trial 180 finished with value: 0.8619989471885233 and parameters: {'n_estimators': 100, 'max_depth': 19, 'min_samples_split': 0.03128140789521608, 'min_samples_leaf': 0.010182962744026722, 'max_features': 'log2'}. Best is trial 176 with value: 0.864021128929114.
[I 2024-01-05 18:34:19,627] Trial 181 finished with value: 0.8623576214474395 and parameters: {'n_estimators': 100, 'max_depth': 19, 'min_samples_split': 0.03053027207186998, 'min_samples_leaf': 0.010119649777634143, 'max_features': 'log2'}. Best is trial 176 with value: 0.864021128929114.
[I 2024-01-05 18:34:46,467] Trial 182 finished with value: 0.8576258258286765 and parameters: {'n_estimators': 108, 'max_depth': 19, 'min_samples_split': 0.030972877111233105, 'min_samples_leaf': 0.017106803110501105, 'max_features': 'log2'}. Best is trial 176 with value: 0.864021128929114.
[I 2024-01-05 18:35:15,492] Trial 183 finished with value: 0.8631777249188035 and parameters: {'n_estimators': 105, 'max_depth': 20, 'min_samples_split': 0.021629828462065872, 'min_samples_leaf': 0.010117866103073301, 'max_features': 'log2'}. Best is trial 176 with value: 0.864021128929114.
[I 2024-01-05 18:35:41,150] Trial 184 finished with value: 0.8579632111568285 and parameters: {'n_estimators': 102, 'max_depth': 21, 'min_samples_split': 0.018233999354243215, 'min_samples_leaf': 0.01611351105099087, 'max_features': 'log2'}. Best is trial 176 with value: 0.864021128929114.
[I 2024-01-05 18:36:08,265] Trial 185 finished with value: 0.8560364016675358 and parameters: {'n_estimators': 122, 'max_depth': 20, 'min_samples_split': 0.02456999842630078, 'min_samples_leaf': 0.02702249644847214, 'max_features': 'log2'}. Best is trial 176 with value: 0.864021128929114.
[I 2024-01-05 18:36:40,443] Trial 186 finished with value: 0.8625135166460263 and parameters: {'n_estimators': 116, 'max_depth': 20, 'min_samples_split': 0.015835288360421997, 'min_samples_leaf': 0.010344378988036253, 'max_features': 'log2'}. Best is trial 176 with value: 0.864021128929114.
[I 2024-01-05 18:37:07,849] Trial 187 finished with value: 0.8566620145903607 and parameters: {'n_estimators': 115, 'max_depth': 20, 'min_samples_split': 0.01563644661008612, 'min_samples_leaf': 0.02072572589388927, 'max_features': 'log2'}. Best is trial 176 with value: 0.864021128929114.
[I 2024-01-05 18:37:33,969] Trial 188 finished with value: 0.8583047658571077 and parameters: {'n_estimators': 103, 'max_depth': 19, 'min_samples_split': 0.010240817402062168, 'min_samples_leaf': 0.015525514907145129, 'max_features': 'log2'}. Best is trial 176 with value: 0.864021128929114.
[I 2024-01-05 18:38:00,271] Trial 189 finished with value: 0.8552349004804809 and parameters: {'n_estimators': 122, 'max_depth': 21, 'min_samples_split': 0.022308653282529303, 'min_samples_leaf': 0.0290955465019384, 'max_features': 'log2'}. Best is trial 176 with value: 0.864021128929114.
[I 2024-01-05 18:38:24,248] Trial 190 finished with value: 0.8567461176604706 and parameters: {'n_estimators': 101, 'max_depth': 19, 'min_samples_split': 0.028453615105408055, 'min_samples_leaf': 0.02084239267584092, 'max_features': 'log2'}. Best is trial 176 with value: 0.864021128929114.
[I 2024-01-05 18:39:00,651] Trial 191 finished with value: 0.8637102112105607 and parameters: {'n_estimators': 140, 'max_depth': 18, 'min_samples_split': 0.030779100021204757, 'min_samples_leaf': 0.011055068719179764, 'max_features': 'log2'}. Best is trial 176 with value: 0.864021128929114.
[I 2024-01-05 18:39:35,531] Trial 192 finished with value: 0.8637777934359343 and parameters: {'n_estimators': 127, 'max_depth': 18, 'min_samples_split': 0.019828395505680385, 'min_samples_leaf': 0.010139730729940833, 'max_features': 'log2'}. Best is trial 176 with value: 0.864021128929114.
[I 2024-01-05 18:40:11,256] Trial 193 finished with value: 0.8577977629834406 and parameters: {'n_estimators': 145, 'max_depth': 18, 'min_samples_split': 0.018207980468387324, 'min_samples_leaf': 0.016605681087361285, 'max_features': 'log2'}. Best is trial 176 with value: 0.864021128929114.
[I 2024-01-05 18:40:43,226] Trial 194 finished with value: 0.858191906305278 and parameters: {'n_estimators': 125, 'max_depth': 20, 'min_samples_split': 0.02659891352177984, 'min_samples_leaf': 0.015017056602020712, 'max_features': 'log2'}. Best is trial 176 with value: 0.864021128929114.
[I 2024-01-05 18:40:54,579] Trial 195 finished with value: 0.8066391228734954 and parameters: {'n_estimators': 116, 'max_depth': 19, 'min_samples_split': 0.021040005286273495, 'min_samples_leaf': 0.2799859549545667, 'max_features': 'log2'}. Best is trial 176 with value: 0.864021128929114.
[I 2024-01-05 18:41:30,782] Trial 196 finished with value: 0.8630113161764384 and parameters: {'n_estimators': 130, 'max_depth': 22, 'min_samples_split': 0.015255528767418435, 'min_samples_leaf': 0.010381645403808665, 'max_features': 'log2'}. Best is trial 176 with value: 0.864021128929114.
[I 2024-01-05 18:42:07,080] Trial 197 finished with value: 0.8632599054164907 and parameters: {'n_estimators': 131, 'max_depth': 23, 'min_samples_split': 0.010273129639464956, 'min_samples_leaf': 0.010271286659099405, 'max_features': 'log2'}. Best is trial 176 with value: 0.864021128929114.
[I 2024-01-05 18:42:37,152] Trial 198 finished with value: 0.8564923198392188 and parameters: {'n_estimators': 131, 'max_depth': 24, 'min_samples_split': 0.014316299444521025, 'min_samples_leaf': 0.02281812059641089, 'max_features': 'log2'}. Best is trial 176 with value: 0.864021128929114.
[I 2024-01-05 18:43:12,123] Trial 199 finished with value: 0.8577431530308331 and parameters: {'n_estimators': 142, 'max_depth': 24, 'min_samples_split': 0.014931968053718839, 'min_samples_leaf': 0.016763599115725305, 'max_features': 'log2'}. Best is trial 176 with value: 0.864021128929114.
[I 2024-01-05 18:43:47,500] Trial 200 finished with value: 0.8638102075933738 and parameters: {'n_estimators': 128, 'max_depth': 17, 'min_samples_split': 0.010444704913067576, 'min_samples_leaf': 0.01014906799309758, 'max_features': 'log2'}. Best is trial 176 with value: 0.864021128929114.
[I 2024-01-05 18:44:19,836] Trial 201 finished with value: 0.8580287004658311 and parameters: {'n_estimators': 128, 'max_depth': 23, 'min_samples_split': 0.011305024744642385, 'min_samples_leaf': 0.016060161804079067, 'max_features': 'log2'}. Best is trial 176 with value: 0.864021128929114.
[I 2024-01-05 18:44:54,688] Trial 202 finished with value: 0.8580920467570948 and parameters: {'n_estimators': 136, 'max_depth': 17, 'min_samples_split': 0.018156588876641327, 'min_samples_leaf': 0.015046883091153217, 'max_features': 'log2'}. Best is trial 176 with value: 0.864021128929114.
[I 2024-01-05 18:45:25,461] Trial 203 finished with value: 0.8628142130740122 and parameters: {'n_estimators': 112, 'max_depth': 22, 'min_samples_split': 0.02203275785715388, 'min_samples_leaf': 0.010577575224233438, 'max_features': 'log2'}. Best is trial 176 with value: 0.864021128929114.
[I 2024-01-05 18:45:51,480] Trial 204 finished with value: 0.8563950558633859 and parameters: {'n_estimators': 111, 'max_depth': 22, 'min_samples_split': 0.010625619956293637, 'min_samples_leaf': 0.021955185202324458, 'max_features': 'log2'}. Best is trial 176 with value: 0.864021128929114.
[I 2024-01-05 18:46:24,198] Trial 205 finished with value: 0.8635779408173091 and parameters: {'n_estimators': 119, 'max_depth': 23, 'min_samples_split': 0.02206533714703986, 'min_samples_leaf': 0.010096700932215682, 'max_features': 'log2'}. Best is trial 176 with value: 0.864021128929114.
[I 2024-01-05 18:46:52,519] Trial 206 finished with value: 0.8568456754917577 and parameters: {'n_estimators': 118, 'max_depth': 23, 'min_samples_split': 0.021626950394113303, 'min_samples_leaf': 0.02005577068533119, 'max_features': 'log2'}. Best is trial 176 with value: 0.864021128929114.
[I 2024-01-05 18:48:29,499] Trial 207 finished with value: 0.8573858928401561 and parameters: {'n_estimators': 126, 'max_depth': 23, 'min_samples_split': 0.01723621884727882, 'min_samples_leaf': 0.010007925290410552, 'max_features': None}. Best is trial 176 with value: 0.864021128929114.
[I 2024-01-05 18:48:53,899] Trial 208 finished with value: 0.8562183011352795 and parameters: {'n_estimators': 109, 'max_depth': 25, 'min_samples_split': 0.01023451402189433, 'min_samples_leaf': 0.026082016544471252, 'max_features': 'log2'}. Best is trial 176 with value: 0.864021128929114.
[I 2024-01-05 18:49:23,747] Trial 209 finished with value: 0.857600801121458 and parameters: {'n_estimators': 121, 'max_depth': 22, 'min_samples_split': 0.02299241293816151, 'min_samples_leaf': 0.01726117402199563, 'max_features': 'log2'}. Best is trial 176 with value: 0.864021128929114.
[I 2024-01-05 18:49:38,500] Trial 210 finished with value: 0.8366792946828241 and parameters: {'n_estimators': 114, 'max_depth': 24, 'min_samples_split': 0.016636365256489496, 'min_samples_leaf': 0.1353528391822143, 'max_features': 'log2'}. Best is trial 176 with value: 0.864021128929114.
[I 2024-01-05 18:50:11,895] Trial 211 finished with value: 0.8582137512480656 and parameters: {'n_estimators': 131, 'max_depth': 18, 'min_samples_split': 0.026378543662966967, 'min_samples_leaf': 0.014736241067320303, 'max_features': 'log2'}. Best is trial 176 with value: 0.864021128929114.
[I 2024-01-05 18:50:30,509] Trial 212 finished with value: 0.842840650527663 and parameters: {'n_estimators': 138, 'max_depth': 22, 'min_samples_split': 0.2834711789239971, 'min_samples_leaf': 0.01433232145616622, 'max_features': 'log2'}. Best is trial 176 with value: 0.864021128929114.
[I 2024-01-05 18:51:12,310] Trial 213 finished with value: 0.8640011547408356 and parameters: {'n_estimators': 154, 'max_depth': 20, 'min_samples_split': 0.022437565662614026, 'min_samples_leaf': 0.010446661867826192, 'max_features': 'log2'}. Best is trial 176 with value: 0.864021128929114.
[I 2024-01-05 18:51:52,553] Trial 214 finished with value: 0.8629926411070376 and parameters: {'n_estimators': 148, 'max_depth': 21, 'min_samples_split': 0.021536985502813032, 'min_samples_leaf': 0.010481096656933498, 'max_features': 'log2'}. Best is trial 176 with value: 0.864021128929114.
[I 2024-01-05 18:52:26,622] Trial 215 finished with value: 0.8566070706946001 and parameters: {'n_estimators': 144, 'max_depth': 21, 'min_samples_split': 0.02093597730036661, 'min_samples_leaf': 0.021188191625381166, 'max_features': 'log2'}. Best is trial 176 with value: 0.864021128929114.
[I 2024-01-05 18:52:44,502] Trial 216 finished with value: 0.8331672067588061 and parameters: {'n_estimators': 149, 'max_depth': 22, 'min_samples_split': 0.015401243285946534, 'min_samples_leaf': 0.15436421621375315, 'max_features': 'log2'}. Best is trial 176 with value: 0.864021128929114.
[I 2024-01-05 18:53:26,898] Trial 217 finished with value: 0.8641492271641213 and parameters: {'n_estimators': 154, 'max_depth': 20, 'min_samples_split': 0.021917836611215425, 'min_samples_leaf': 0.01019087423324811, 'max_features': 'log2'}. Best is trial 217 with value: 0.8641492271641213.
[I 2024-01-05 18:53:48,994] Trial 218 finished with value: 0.8421983361558345 and parameters: {'n_estimators': 153, 'max_depth': 20, 'min_samples_split': 0.010291329127853958, 'min_samples_leaf': 0.09455860208092422, 'max_features': 'log2'}. Best is trial 217 with value: 0.8641492271641213.
[I 2024-01-05 18:54:30,575] Trial 219 finished with value: 0.8571073327679095 and parameters: {'n_estimators': 173, 'max_depth': 21, 'min_samples_split': 0.022110815168079154, 'min_samples_leaf': 0.019100602929485646, 'max_features': 'log2'}. Best is trial 217 with value: 0.8641492271641213.
[I 2024-01-05 18:55:13,903] Trial 220 finished with value: 0.863736016619401 and parameters: {'n_estimators': 157, 'max_depth': 23, 'min_samples_split': 0.016410530011887428, 'min_samples_leaf': 0.010101397330102098, 'max_features': 'log2'}. Best is trial 217 with value: 0.8641492271641213.
[I 2024-01-05 18:55:52,645] Trial 221 finished with value: 0.8581135063283254 and parameters: {'n_estimators': 155, 'max_depth': 23, 'min_samples_split': 0.017340434663513715, 'min_samples_leaf': 0.01582157162070445, 'max_features': 'log2'}. Best is trial 217 with value: 0.8641492271641213.
[I 2024-01-05 18:56:38,313] Trial 222 finished with value: 0.8633031393390587 and parameters: {'n_estimators': 168, 'max_depth': 21, 'min_samples_split': 0.02443988752221573, 'min_samples_leaf': 0.010004244805161875, 'max_features': 'log2'}. Best is trial 217 with value: 0.8641492271641213.
[I 2024-01-05 18:57:19,770] Trial 223 finished with value: 0.858188338964214 and parameters: {'n_estimators': 165, 'max_depth': 23, 'min_samples_split': 0.023398637924630615, 'min_samples_leaf': 0.015729292156199396, 'max_features': 'log2'}. Best is trial 217 with value: 0.8641492271641213.
[I 2024-01-05 18:57:56,246] Trial 224 finished with value: 0.8562794682591827 and parameters: {'n_estimators': 158, 'max_depth': 22, 'min_samples_split': 0.025489783739541038, 'min_samples_leaf': 0.022523311386780882, 'max_features': 'log2'}. Best is trial 217 with value: 0.8641492271641213.
