[I 2024-01-05 21:22:34,194] Trial 450 finished with value: 0.8571397372834921 and parameters: {'n_estimators': 165, 'max_depth': 32, 'min_samples_split': 0.010122815891693608, 'min_samples_leaf': 0.018274767382880624, 'max_features': 'log2'}. Best is trial 324 with value: 0.8642992343012382.
[I 2024-01-05 21:23:00,063] Trial 451 finished with value: 0.8545575401004815 and parameters: {'n_estimators': 125, 'max_depth': 22, 'min_samples_split': 0.015200793934548967, 'min_samples_leaf': 0.03189071980082593, 'max_features': 'log2'}. Best is trial 324 with value: 0.8642992343012382.
[I 2024-01-05 21:23:36,738] Trial 452 finished with value: 0.8580690783576971 and parameters: {'n_estimators': 147, 'max_depth': 23, 'min_samples_split': 0.026277837461491718, 'min_samples_leaf': 0.01580435973989018, 'max_features': 'log2'}. Best is trial 324 with value: 0.8642992343012382.
[I 2024-01-05 21:24:45,765] Trial 453 finished with value: 0.8553019826029139 and parameters: {'n_estimators': 308, 'max_depth': 21, 'min_samples_split': 0.02063984283480825, 'min_samples_leaf': 0.024829399212513082, 'max_features': 'log2'}. Best is trial 324 with value: 0.8642992343012382.
[I 2024-01-05 21:25:31,714] Trial 454 finished with value: 0.8583356055658552 and parameters: {'n_estimators': 183, 'max_depth': 20, 'min_samples_split': 0.010012013705043487, 'min_samples_leaf': 0.014985913503770196, 'max_features': 'log2'}. Best is trial 324 with value: 0.8642992343012382.
[I 2024-01-05 21:26:07,550] Trial 455 finished with value: 0.8637667512716277 and parameters: {'n_estimators': 131, 'max_depth': 22, 'min_samples_split': 0.017189434441297516, 'min_samples_leaf': 0.0101606115123832, 'max_features': 'log2'}. Best is trial 324 with value: 0.8642992343012382.
[I 2024-01-05 21:26:44,597] Trial 456 finished with value: 0.8567820672341944 and parameters: {'n_estimators': 155, 'max_depth': 23, 'min_samples_split': 0.035625537886942615, 'min_samples_leaf': 0.020111407188461473, 'max_features': 'log2'}. Best is trial 324 with value: 0.8642992343012382.
[I 2024-01-05 21:27:20,578] Trial 457 finished with value: 0.8621810222282076 and parameters: {'n_estimators': 135, 'max_depth': 31, 'min_samples_split': 0.02888213671537567, 'min_samples_leaf': 0.010117625713990622, 'max_features': 'log2'}. Best is trial 324 with value: 0.8642992343012382.
[I 2024-01-05 21:28:00,738] Trial 458 finished with value: 0.8642213277501417 and parameters: {'n_estimators': 146, 'max_depth': 29, 'min_samples_split': 0.02224122799276633, 'min_samples_leaf': 0.010021654445420162, 'max_features': 'log2'}. Best is trial 324 with value: 0.8642992343012382.
[I 2024-01-05 21:28:36,149] Trial 459 finished with value: 0.8569013441258134 and parameters: {'n_estimators': 147, 'max_depth': 30, 'min_samples_split': 0.025121352750960266, 'min_samples_leaf': 0.019603976587467025, 'max_features': 'log2'}. Best is trial 324 with value: 0.8642992343012382.
[I 2024-01-05 21:29:06,267] Trial 460 finished with value: 0.8534019287938162 and parameters: {'n_estimators': 143, 'max_depth': 29, 'min_samples_split': 0.08079814074208366, 'min_samples_leaf': 0.015302172648398558, 'max_features': 'log2'}. Best is trial 324 with value: 0.8642992343012382.
[I 2024-01-05 21:29:20,391] Trial 461 finished with value: 0.8319900371211254 and parameters: {'n_estimators': 133, 'max_depth': 23, 'min_samples_split': 0.03207004909161437, 'min_samples_leaf': 0.1767634159094382, 'max_features': 'log2'}. Best is trial 324 with value: 0.8642992343012382.
[I 2024-01-05 21:29:53,502] Trial 462 finished with value: 0.8556506505305952 and parameters: {'n_estimators': 151, 'max_depth': 30, 'min_samples_split': 0.017687264774274833, 'min_samples_leaf': 0.027450623935746002, 'max_features': 'log2'}. Best is trial 324 with value: 0.8642992343012382.
[I 2024-01-05 21:30:29,051] Trial 463 finished with value: 0.8584185889060881 and parameters: {'n_estimators': 142, 'max_depth': 30, 'min_samples_split': 0.023061592345749855, 'min_samples_leaf': 0.015559698650974538, 'max_features': 'log2'}. Best is trial 324 with value: 0.8642992343012382.
[I 2024-01-05 21:31:05,705] Trial 464 finished with value: 0.8564382994384078 and parameters: {'n_estimators': 157, 'max_depth': 29, 'min_samples_split': 0.01569014839893305, 'min_samples_leaf': 0.02123008773999359, 'max_features': 'sqrt'}. Best is trial 324 with value: 0.8642992343012382.
[I 2024-01-05 21:31:38,111] Trial 465 finished with value: 0.8573235605044746 and parameters: {'n_estimators': 133, 'max_depth': 29, 'min_samples_split': 0.03903849497133112, 'min_samples_leaf': 0.015427488705105043, 'max_features': 'log2'}. Best is trial 324 with value: 0.8642992343012382.
[I 2024-01-05 21:32:11,941] Trial 466 finished with value: 0.8563636753725585 and parameters: {'n_estimators': 150, 'max_depth': 29, 'min_samples_split': 0.026997138527964926, 'min_samples_leaf': 0.02435285248217798, 'max_features': 'log2'}. Best is trial 324 with value: 0.8642992343012382.
[I 2024-01-05 21:34:02,812] Trial 467 finished with value: 0.8507760800894395 and parameters: {'n_estimators': 161, 'max_depth': 31, 'min_samples_split': 0.020746398222332006, 'min_samples_leaf': 0.015074330168170608, 'max_features': None}. Best is trial 324 with value: 0.8642992343012382.
[I 2024-01-05 21:34:35,865] Trial 468 finished with value: 0.8569206923515115 and parameters: {'n_estimators': 140, 'max_depth': 19, 'min_samples_split': 0.01664956328626352, 'min_samples_leaf': 0.02027566329649534, 'max_features': 'log2'}. Best is trial 324 with value: 0.8642992343012382.
[I 2024-01-05 21:35:05,842] Trial 469 finished with value: 0.8583364687607021 and parameters: {'n_estimators': 118, 'max_depth': 30, 'min_samples_split': 0.03143786656572963, 'min_samples_leaf': 0.014996171861369107, 'max_features': 'log2'}. Best is trial 324 with value: 0.8642992343012382.
[I 2024-01-05 21:35:35,615] Trial 470 finished with value: 0.8510185058261696 and parameters: {'n_estimators': 171, 'max_depth': 32, 'min_samples_split': 0.024290407255183305, 'min_samples_leaf': 0.05763790280054355, 'max_features': 'log2'}. Best is trial 324 with value: 0.8642992343012382.
[I 2024-01-05 21:36:19,902] Trial 471 finished with value: 0.8641129587110757 and parameters: {'n_estimators': 159, 'max_depth': 19, 'min_samples_split': 0.014813486178301678, 'min_samples_leaf': 0.010142143733898542, 'max_features': 'log2'}. Best is trial 324 with value: 0.8642992343012382.
[I 2024-01-05 21:36:38,668] Trial 472 finished with value: 0.8356947456464852 and parameters: {'n_estimators': 145, 'max_depth': 19, 'min_samples_split': 0.015293540748438075, 'min_samples_leaf': 0.13590903969108353, 'max_features': 'log2'}. Best is trial 324 with value: 0.8642992343012382.
[I 2024-01-05 21:36:58,197] Trial 473 finished with value: 0.8436442442663153 and parameters: {'n_estimators': 130, 'max_depth': 19, 'min_samples_split': 0.01998063523856182, 'min_samples_leaf': 0.08675121057500444, 'max_features': 'log2'}. Best is trial 324 with value: 0.8642992343012382.
[I 2024-01-05 21:37:32,179] Trial 474 finished with value: 0.8540020644704873 and parameters: {'n_estimators': 165, 'max_depth': 20, 'min_samples_split': 0.029131450817630848, 'min_samples_leaf': 0.03363381407067298, 'max_features': 'log2'}. Best is trial 324 with value: 0.8642992343012382.
[I 2024-01-05 21:38:08,231] Trial 475 finished with value: 0.8566673850173295 and parameters: {'n_estimators': 152, 'max_depth': 20, 'min_samples_split': 0.014919848315477643, 'min_samples_leaf': 0.020370759143599752, 'max_features': 'log2'}. Best is trial 324 with value: 0.8642992343012382.
[I 2024-01-05 21:38:46,509] Trial 476 finished with value: 0.8632104372525052 and parameters: {'n_estimators': 139, 'max_depth': 19, 'min_samples_split': 0.010062919660750992, 'min_samples_leaf': 0.010427062555837112, 'max_features': 'log2'}. Best is trial 324 with value: 0.8642992343012382.
[I 2024-01-05 21:39:21,973] Trial 477 finished with value: 0.8557486285813596 and parameters: {'n_estimators': 160, 'max_depth': 21, 'min_samples_split': 0.023238045653612423, 'min_samples_leaf': 0.02719562250817205, 'max_features': 'log2'}. Best is trial 324 with value: 0.8642992343012382.
[I 2024-01-05 21:39:59,458] Trial 478 finished with value: 0.8584138125501459 and parameters: {'n_estimators': 149, 'max_depth': 29, 'min_samples_split': 0.019899071185060055, 'min_samples_leaf': 0.015245139674214186, 'max_features': 'log2'}. Best is trial 324 with value: 0.8642992343012382.
[I 2024-01-05 21:40:31,612] Trial 479 finished with value: 0.8582710163591669 and parameters: {'n_estimators': 127, 'max_depth': 19, 'min_samples_split': 0.015428159762078873, 'min_samples_leaf': 0.014689198553813742, 'max_features': 'log2'}. Best is trial 324 with value: 0.8642992343012382.
[I 2024-01-05 21:41:18,090] Trial 480 finished with value: 0.8632925073362786 and parameters: {'n_estimators': 172, 'max_depth': 28, 'min_samples_split': 0.025037800936900764, 'min_samples_leaf': 0.010041165402239045, 'max_features': 'log2'}. Best is trial 324 with value: 0.8642992343012382.
[I 2024-01-05 21:41:58,776] Trial 481 finished with value: 0.8629984151782443 and parameters: {'n_estimators': 156, 'max_depth': 18, 'min_samples_split': 0.03158262470321929, 'min_samples_leaf': 0.010192387139882405, 'max_features': 'log2'}. Best is trial 324 with value: 0.8642992343012382.
[I 2024-01-05 21:42:31,544] Trial 482 finished with value: 0.8568567131733176 and parameters: {'n_estimators': 139, 'max_depth': 20, 'min_samples_split': 0.015239790316474865, 'min_samples_leaf': 0.020560381148010655, 'max_features': 'log2'}. Best is trial 324 with value: 0.8642992343012382.
[I 2024-01-05 21:42:54,447] Trial 483 finished with value: 0.8418361640099418 and parameters: {'n_estimators': 166, 'max_depth': 21, 'min_samples_split': 0.020780973654929605, 'min_samples_leaf': 0.10657661057623703, 'max_features': 'log2'}. Best is trial 324 with value: 0.8642992343012382.
[I 2024-01-05 21:43:20,965] Trial 484 finished with value: 0.8564149542129205 and parameters: {'n_estimators': 117, 'max_depth': 20, 'min_samples_split': 0.026729972215715034, 'min_samples_leaf': 0.024347781481329368, 'max_features': 'sqrt'}. Best is trial 324 with value: 0.8642992343012382.
[I 2024-01-05 21:43:56,273] Trial 485 finished with value: 0.8569652740275411 and parameters: {'n_estimators': 147, 'max_depth': 21, 'min_samples_split': 0.015003541344404063, 'min_samples_leaf': 0.019173711250372823, 'max_features': 'log2'}. Best is trial 324 with value: 0.8642992343012382.
[I 2024-01-05 21:45:15,018] Trial 486 finished with value: 0.8573994029184029 and parameters: {'n_estimators': 321, 'max_depth': 19, 'min_samples_split': 0.03639580116436898, 'min_samples_leaf': 0.015162983302049673, 'max_features': 'log2'}. Best is trial 324 with value: 0.8642992343012382.
[I 2024-01-05 21:45:48,302] Trial 487 finished with value: 0.8582435031339422 and parameters: {'n_estimators': 131, 'max_depth': 20, 'min_samples_split': 0.020879296011121172, 'min_samples_leaf': 0.015196959693803098, 'max_features': 'log2'}. Best is trial 324 with value: 0.8642992343012382.
[I 2024-01-05 21:46:31,781] Trial 488 finished with value: 0.8639223954692514 and parameters: {'n_estimators': 159, 'max_depth': 22, 'min_samples_split': 0.010278592319226561, 'min_samples_leaf': 0.01025631051717318, 'max_features': 'log2'}. Best is trial 324 with value: 0.8642992343012382.
[I 2024-01-05 21:47:42,648] Trial 489 finished with value: 0.8152138679832015 and parameters: {'n_estimators': 163, 'max_depth': 18, 'min_samples_split': 0.12910920063909972, 'min_samples_leaf': 0.028547202701350964, 'max_features': None}. Best is trial 324 with value: 0.8642992343012382.
[I 2024-01-05 21:48:23,833] Trial 490 finished with value: 0.8567817398724682 and parameters: {'n_estimators': 174, 'max_depth': 21, 'min_samples_split': 0.010873345028893436, 'min_samples_leaf': 0.020342332514681205, 'max_features': 'log2'}. Best is trial 324 with value: 0.8642992343012382.
[I 2024-01-05 21:49:04,418] Trial 491 finished with value: 0.8584612251768811 and parameters: {'n_estimators': 159, 'max_depth': 17, 'min_samples_split': 0.013872581081778402, 'min_samples_leaf': 0.014841901398125319, 'max_features': 'log2'}. Best is trial 324 with value: 0.8642992343012382.
[I 2024-01-05 21:49:47,540] Trial 492 finished with value: 0.8643607990539763 and parameters: {'n_estimators': 155, 'max_depth': 31, 'min_samples_split': 0.010295743725836934, 'min_samples_leaf': 0.010012320708820526, 'max_features': 'log2'}. Best is trial 492 with value: 0.8643607990539763.
[I 2024-01-05 21:50:02,411] Trial 493 finished with value: 0.8128209200669587 and parameters: {'n_estimators': 152, 'max_depth': 19, 'min_samples_split': 0.010659371220154392, 'min_samples_leaf': 0.26686308240795864, 'max_features': 'log2'}. Best is trial 492 with value: 0.8643607990539763.
[I 2024-01-05 21:50:44,614] Trial 494 finished with value: 0.8637334616210712 and parameters: {'n_estimators': 152, 'max_depth': 31, 'min_samples_split': 0.0101949595807922, 'min_samples_leaf': 0.010261615751389674, 'max_features': 'log2'}. Best is trial 492 with value: 0.8643607990539763.
[I 2024-01-05 21:51:22,358] Trial 495 finished with value: 0.8561881472761088 and parameters: {'n_estimators': 165, 'max_depth': 31, 'min_samples_split': 0.015118826295671258, 'min_samples_leaf': 0.02370223235754912, 'max_features': 'log2'}. Best is trial 492 with value: 0.8643607990539763.
[I 2024-01-05 21:51:57,638] Trial 496 finished with value: 0.8572483955756448 and parameters: {'n_estimators': 144, 'max_depth': 20, 'min_samples_split': 0.01941575704669651, 'min_samples_leaf': 0.017668846378030685, 'max_features': 'log2'}. Best is trial 492 with value: 0.8643607990539763.
[I 2024-01-05 21:52:35,195] Trial 497 finished with value: 0.8569144784677916 and parameters: {'n_estimators': 156, 'max_depth': 30, 'min_samples_split': 0.014653800835414663, 'min_samples_leaf': 0.018865871603033664, 'max_features': 'log2'}. Best is trial 492 with value: 0.8643607990539763.
[I 2024-01-05 21:53:19,841] Trial 498 finished with value: 0.858483880255853 and parameters: {'n_estimators': 175, 'max_depth': 32, 'min_samples_split': 0.010186856837929442, 'min_samples_leaf': 0.014512203721813673, 'max_features': 'log2'}. Best is trial 492 with value: 0.8643607990539763.
[I 2024-01-05 21:53:33,864] Trial 499 finished with value: 0.8296998488270285 and parameters: {'n_estimators': 144, 'max_depth': 32, 'min_samples_split': 0.020842262667260022, 'min_samples_leaf': 0.2097985336245365, 'max_features': 'log2'}. Best is trial 492 with value: 0.8643607990539763.
