[I 2024-01-05 16:48:47,772] Trial 75 finished with value: 0.8535921728933445 and parameters: {'n_estimators': 312, 'max_depth': 4, 'min_samples_split': 0.018877927667255386, 'min_samples_leaf': 0.03374101308853498, 'max_features': 'sqrt'}. Best is trial 27 with value: 0.8611976397004308.
[I 2024-01-05 16:50:09,224] Trial 76 finished with value: 0.8542832736425774 and parameters: {'n_estimators': 376, 'max_depth': 6, 'min_samples_split': 0.041352131048183326, 'min_samples_leaf': 0.02863661965121271, 'max_features': 'sqrt'}. Best is trial 27 with value: 0.8611976397004308.
[I 2024-01-05 16:51:07,289] Trial 77 finished with value: 0.8519837949060933 and parameters: {'n_estimators': 293, 'max_depth': 12, 'min_samples_split': 0.09646977556004177, 'min_samples_leaf': 0.017659724356770184, 'max_features': 'sqrt'}. Best is trial 27 with value: 0.8611976397004308.
[I 2024-01-05 16:51:55,613] Trial 78 finished with value: 0.8439557283926146 and parameters: {'n_estimators': 352, 'max_depth': 2, 'min_samples_split': 0.03129628149833132, 'min_samples_leaf': 0.04451144512540674, 'max_features': 'log2'}. Best is trial 27 with value: 0.8611976397004308.
[I 2024-01-05 16:52:40,648] Trial 79 finished with value: 0.8422599856029391 and parameters: {'n_estimators': 339, 'max_depth': 18, 'min_samples_split': 0.26171882784090156, 'min_samples_leaf': 0.12936354401191172, 'max_features': 'sqrt'}. Best is trial 27 with value: 0.8611976397004308.
[I 2024-01-05 16:54:04,285] Trial 80 finished with value: 0.7014376585418883 and parameters: {'n_estimators': 469, 'max_depth': 11, 'min_samples_split': 0.058976476184884, 'min_samples_leaf': 0.2578893482245911, 'max_features': None}. Best is trial 27 with value: 0.8611976397004308.
[I 2024-01-05 16:55:15,840] Trial 81 finished with value: 0.8537697771510638 and parameters: {'n_estimators': 332, 'max_depth': 9, 'min_samples_split': 0.07356929386785012, 'min_samples_leaf': 0.014812486035118106, 'max_features': 'sqrt'}. Best is trial 27 with value: 0.8611976397004308.
[I 2024-01-05 16:56:31,956] Trial 82 finished with value: 0.8538088545868252 and parameters: {'n_estimators': 359, 'max_depth': 7, 'min_samples_split': 0.07155852384387139, 'min_samples_leaf': 0.02479768051662481, 'max_features': 'sqrt'}. Best is trial 27 with value: 0.8611976397004308.
[I 2024-01-05 16:57:56,388] Trial 83 finished with value: 0.8565185429498262 and parameters: {'n_estimators': 399, 'max_depth': 8, 'min_samples_split': 0.08379507070017429, 'min_samples_leaf': 0.011553400727455494, 'max_features': 'sqrt'}. Best is trial 27 with value: 0.8611976397004308.
[I 2024-01-05 16:59:40,182] Trial 84 finished with value: 0.8600283097652976 and parameters: {'n_estimators': 439, 'max_depth': 6, 'min_samples_split': 0.05230440988927226, 'min_samples_leaf': 0.010133055058762929, 'max_features': 'sqrt'}. Best is trial 27 with value: 0.8611976397004308.
[I 2024-01-05 17:01:04,873] Trial 85 finished with value: 0.850260209948855 and parameters: {'n_estimators': 487, 'max_depth': 3, 'min_samples_split': 0.05274712689707246, 'min_samples_leaf': 0.029621028955994708, 'max_features': 'sqrt'}. Best is trial 27 with value: 0.8611976397004308.
[I 2024-01-05 17:01:52,360] Trial 86 finished with value: 0.8323162665129675 and parameters: {'n_estimators': 415, 'max_depth': 5, 'min_samples_split': 0.04408560805755168, 'min_samples_leaf': 0.15892745841781103, 'max_features': 'sqrt'}. Best is trial 27 with value: 0.8611976397004308.
[I 2024-01-05 17:03:11,241] Trial 87 finished with value: 0.852758098871648 and parameters: {'n_estimators': 388, 'max_depth': 26, 'min_samples_split': 0.036228067527064714, 'min_samples_leaf': 0.03715092800963133, 'max_features': 'log2'}. Best is trial 27 with value: 0.8611976397004308.
[I 2024-01-05 17:04:50,272] Trial 88 finished with value: 0.8556542131228895 and parameters: {'n_estimators': 436, 'max_depth': 6, 'min_samples_split': 0.051531251172309625, 'min_samples_leaf': 0.020654955435736824, 'max_features': 'sqrt'}. Best is trial 27 with value: 0.8611976397004308.
[I 2024-01-05 17:06:32,288] Trial 89 finished with value: 0.8578111633179276 and parameters: {'n_estimators': 443, 'max_depth': 13, 'min_samples_split': 0.062490319051137916, 'min_samples_leaf': 0.010204963590050445, 'max_features': 'sqrt'}. Best is trial 27 with value: 0.8611976397004308.
[I 2024-01-05 17:08:09,229] Trial 90 finished with value: 0.8542410444854731 and parameters: {'n_estimators': 445, 'max_depth': 14, 'min_samples_split': 0.015645607824674876, 'min_samples_leaf': 0.028694177556270704, 'max_features': 'sqrt'}. Best is trial 27 with value: 0.8611976397004308.
[I 2024-01-05 17:09:55,014] Trial 91 finished with value: 0.85494824668314 and parameters: {'n_estimators': 466, 'max_depth': 32, 'min_samples_split': 0.06005728355046318, 'min_samples_leaf': 0.018196586214480483, 'max_features': 'sqrt'}. Best is trial 27 with value: 0.8611976397004308.
[I 2024-01-05 17:11:44,094] Trial 92 finished with value: 0.8582463275630602 and parameters: {'n_estimators': 481, 'max_depth': 13, 'min_samples_split': 0.06689575156022717, 'min_samples_leaf': 0.010144295749043894, 'max_features': 'sqrt'}. Best is trial 27 with value: 0.8611976397004308.
[I 2024-01-05 17:13:29,821] Trial 93 finished with value: 0.8545106017258737 and parameters: {'n_estimators': 478, 'max_depth': 16, 'min_samples_split': 0.06411416041700034, 'min_samples_leaf': 0.01758497790279177, 'max_features': 'sqrt'}. Best is trial 27 with value: 0.8611976397004308.
[I 2024-01-05 17:15:22,129] Trial 94 finished with value: 0.8550606667259084 and parameters: {'n_estimators': 497, 'max_depth': 14, 'min_samples_split': 0.028414897538551257, 'min_samples_leaf': 0.02551706713945527, 'max_features': 'sqrt'}. Best is trial 27 with value: 0.8611976397004308.
[I 2024-01-05 17:16:52,126] Trial 95 finished with value: 0.8525523713143391 and parameters: {'n_estimators': 445, 'max_depth': 13, 'min_samples_split': 0.044549540264708046, 'min_samples_leaf': 0.038079353560658315, 'max_features': 'sqrt'}. Best is trial 27 with value: 0.8611976397004308.
[I 2024-01-05 17:18:48,146] Trial 96 finished with value: 0.8616927256943576 and parameters: {'n_estimators': 456, 'max_depth': 12, 'min_samples_split': 0.03959204937260134, 'min_samples_leaf': 0.010188686297404036, 'max_features': 'log2'}. Best is trial 96 with value: 0.8616927256943576.
[I 2024-01-05 17:20:30,503] Trial 97 finished with value: 0.8533883167373313 and parameters: {'n_estimators': 488, 'max_depth': 15, 'min_samples_split': 0.023860551531226508, 'min_samples_leaf': 0.03321735066207516, 'max_features': 'log2'}. Best is trial 96 with value: 0.8616927256943576.
[I 2024-01-05 17:22:22,068] Trial 98 finished with value: 0.8570692789630584 and parameters: {'n_estimators': 457, 'max_depth': 12, 'min_samples_split': 0.03823073798388429, 'min_samples_leaf': 0.017657723929847293, 'max_features': 'log2'}. Best is trial 96 with value: 0.8616927256943576.
[I 2024-01-05 17:23:57,842] Trial 99 finished with value: 0.8550940032348091 and parameters: {'n_estimators': 423, 'max_depth': 11, 'min_samples_split': 0.05066044441631471, 'min_samples_leaf': 0.025743052177187482, 'max_features': 'log2'}. Best is trial 96 with value: 0.8616927256943576.
[I 2024-01-05 17:25:20,595] Trial 100 finished with value: 0.8512625545017422 and parameters: {'n_estimators': 435, 'max_depth': 13, 'min_samples_split': 0.03267735076903705, 'min_samples_leaf': 0.04492496140945757, 'max_features': 'log2'}. Best is trial 96 with value: 0.8616927256943576.
[I 2024-01-05 17:27:12,155] Trial 101 finished with value: 0.8589672906941601 and parameters: {'n_estimators': 473, 'max_depth': 10, 'min_samples_split': 0.05636954980014058, 'min_samples_leaf': 0.010688212367002178, 'max_features': 'log2'}. Best is trial 96 with value: 0.8616927256943576.
[I 2024-01-05 17:29:04,592] Trial 102 finished with value: 0.8564674131767738 and parameters: {'n_estimators': 476, 'max_depth': 10, 'min_samples_split': 0.047635070880722476, 'min_samples_leaf': 0.016800067445315807, 'max_features': 'log2'}. Best is trial 96 with value: 0.8616927256943576.
[I 2024-01-05 17:30:47,021] Trial 103 finished with value: 0.8550008289292842 and parameters: {'n_estimators': 456, 'max_depth': 12, 'min_samples_split': 0.05598336613867255, 'min_samples_leaf': 0.023009472064990728, 'max_features': 'log2'}. Best is trial 96 with value: 0.8616927256943576.
[I 2024-01-05 17:32:03,771] Trial 104 finished with value: 0.846599180086446 and parameters: {'n_estimators': 476, 'max_depth': 10, 'min_samples_split': 0.18411465989672732, 'min_samples_leaf': 0.015541735315171914, 'max_features': 'log2'}. Best is trial 96 with value: 0.8616927256943576.
[I 2024-01-05 17:33:37,368] Trial 105 finished with value: 0.8534752987365433 and parameters: {'n_estimators': 444, 'max_depth': 16, 'min_samples_split': 0.06632707285532771, 'min_samples_leaf': 0.0310673086470781, 'max_features': 'log2'}. Best is trial 96 with value: 0.8616927256943576.
[I 2024-01-05 17:35:39,184] Trial 106 finished with value: 0.861434303652793 and parameters: {'n_estimators': 486, 'max_depth': 9, 'min_samples_split': 0.04008988706804467, 'min_samples_leaf': 0.01044672599923251, 'max_features': 'log2'}. Best is trial 96 with value: 0.8616927256943576.
[I 2024-01-05 17:37:31,226] Trial 107 finished with value: 0.8554212398389733 and parameters: {'n_estimators': 493, 'max_depth': 13, 'min_samples_split': 0.04003216054459667, 'min_samples_leaf': 0.02416516605649442, 'max_features': 'log2'}. Best is trial 96 with value: 0.8616927256943576.
[I 2024-01-05 17:39:31,250] Trial 108 finished with value: 0.8575694101896655 and parameters: {'n_estimators': 483, 'max_depth': 11, 'min_samples_split': 0.021794160347987597, 'min_samples_leaf': 0.016677396101395993, 'max_features': 'log2'}. Best is trial 96 with value: 0.8616927256943576.
[I 2024-01-05 17:41:01,978] Trial 109 finished with value: 0.8519080247055907 and parameters: {'n_estimators': 469, 'max_depth': 9, 'min_samples_split': 0.056691037642012505, 'min_samples_leaf': 0.0412291187531828, 'max_features': 'log2'}. Best is trial 96 with value: 0.8616927256943576.
[I 2024-01-05 17:41:49,599] Trial 110 finished with value: 0.8314461524919474 and parameters: {'n_estimators': 450, 'max_depth': 10, 'min_samples_split': 0.03178880322949612, 'min_samples_leaf': 0.1816058556450891, 'max_features': 'log2'}. Best is trial 96 with value: 0.8616927256943576.
[I 2024-01-05 17:43:52,487] Trial 111 finished with value: 0.8580115357123226 and parameters: {'n_estimators': 483, 'max_depth': 11, 'min_samples_split': 0.02014693120881087, 'min_samples_leaf': 0.015400063026611328, 'max_features': 'log2'}. Best is trial 96 with value: 0.8616927256943576.
[I 2024-01-05 17:45:59,600] Trial 112 finished with value: 0.8630573920218263 and parameters: {'n_estimators': 463, 'max_depth': 12, 'min_samples_split': 0.012150590889851189, 'min_samples_leaf': 0.010722169240100166, 'max_features': 'log2'}. Best is trial 112 with value: 0.8630573920218263.
[I 2024-01-05 17:47:51,534] Trial 113 finished with value: 0.8561147880102439 and parameters: {'n_estimators': 480, 'max_depth': 11, 'min_samples_split': 0.011609095727978528, 'min_samples_leaf': 0.02148479887383866, 'max_features': 'log2'}. Best is trial 112 with value: 0.8630573920218263.
[I 2024-01-05 17:49:40,191] Trial 114 finished with value: 0.8540981163596632 and parameters: {'n_estimators': 499, 'max_depth': 12, 'min_samples_split': 0.026023619287495497, 'min_samples_leaf': 0.029496658439167874, 'max_features': 'log2'}. Best is trial 112 with value: 0.8630573920218263.
[I 2024-01-05 17:50:24,882] Trial 115 finished with value: 0.768074590597198 and parameters: {'n_estimators': 467, 'max_depth': 11, 'min_samples_split': 0.019615430074016626, 'min_samples_leaf': 0.29752975812633375, 'max_features': 'log2'}. Best is trial 112 with value: 0.8630573920218263.
[I 2024-01-05 17:51:32,859] Trial 116 finished with value: 0.858017281314296 and parameters: {'n_estimators': 268, 'max_depth': 12, 'min_samples_split': 0.01617214564006543, 'min_samples_leaf': 0.0156583746016838, 'max_features': 'log2'}. Best is trial 112 with value: 0.8630573920218263.
[I 2024-01-05 17:52:29,729] Trial 117 finished with value: 0.853419297255426 and parameters: {'n_estimators': 273, 'max_depth': 12, 'min_samples_split': 0.010711178363653779, 'min_samples_leaf': 0.03374386664343584, 'max_features': 'log2'}. Best is trial 112 with value: 0.8630573920218263.
[I 2024-01-05 17:53:17,040] Trial 118 finished with value: 0.8504716383559128 and parameters: {'n_estimators': 260, 'max_depth': 14, 'min_samples_split': 0.017382816901801525, 'min_samples_leaf': 0.0517410829934441, 'max_features': 'log2'}. Best is trial 112 with value: 0.8630573920218263.
[I 2024-01-05 17:54:19,495] Trial 119 finished with value: 0.858160055804517 and parameters: {'n_estimators': 246, 'max_depth': 10, 'min_samples_split': 0.02930442746924628, 'min_samples_leaf': 0.015583534685870797, 'max_features': 'log2'}. Best is trial 112 with value: 0.8630573920218263.
[I 2024-01-05 17:55:11,948] Trial 120 finished with value: 0.8556532874393439 and parameters: {'n_estimators': 232, 'max_depth': 10, 'min_samples_split': 0.0388060086520522, 'min_samples_leaf': 0.023548193680500172, 'max_features': 'log2'}. Best is trial 112 with value: 0.8630573920218263.
[I 2024-01-05 17:56:19,273] Trial 121 finished with value: 0.857804833719627 and parameters: {'n_estimators': 271, 'max_depth': 9, 'min_samples_split': 0.02870093819029511, 'min_samples_leaf': 0.015905641309092923, 'max_features': 'log2'}. Best is trial 112 with value: 0.8630573920218263.
[I 2024-01-05 17:57:21,446] Trial 122 finished with value: 0.8581724245247878 and parameters: {'n_estimators': 247, 'max_depth': 13, 'min_samples_split': 0.0234491997691968, 'min_samples_leaf': 0.015523114310151728, 'max_features': 'log2'}. Best is trial 112 with value: 0.8630573920218263.
[I 2024-01-05 17:58:23,091] Trial 123 finished with value: 0.8615618836903579 and parameters: {'n_estimators': 247, 'max_depth': 12, 'min_samples_split': 0.04294820142742078, 'min_samples_leaf': 0.010366727837046036, 'max_features': 'log2'}. Best is trial 112 with value: 0.8630573920218263.
[I 2024-01-05 17:59:24,975] Trial 124 finished with value: 0.861870931980827 and parameters: {'n_estimators': 247, 'max_depth': 15, 'min_samples_split': 0.041518418210259964, 'min_samples_leaf': 0.010293146885495628, 'max_features': 'log2'}. Best is trial 112 with value: 0.8630573920218263.
[I 2024-01-05 18:01:18,345] Trial 125 finished with value: 0.8398326247402412 and parameters: {'n_estimators': 194, 'max_depth': 15, 'min_samples_split': 0.04395500888075716, 'min_samples_leaf': 0.027319937170030006, 'max_features': None}. Best is trial 112 with value: 0.8630573920218263.
[I 2024-01-05 18:02:22,822] Trial 126 finished with value: 0.8617218076887813 and parameters: {'n_estimators': 252, 'max_depth': 14, 'min_samples_split': 0.03619084468231445, 'min_samples_leaf': 0.010260250316330407, 'max_features': 'log2'}. Best is trial 112 with value: 0.8630573920218263.
[I 2024-01-05 18:03:12,774] Trial 127 finished with value: 0.856069741601701 and parameters: {'n_estimators': 218, 'max_depth': 14, 'min_samples_split': 0.047455476651423883, 'min_samples_leaf': 0.0219761927167139, 'max_features': 'log2'}. Best is trial 112 with value: 0.8630573920218263.
[I 2024-01-05 18:04:04,618] Trial 128 finished with value: 0.8612858968872334 and parameters: {'n_estimators': 210, 'max_depth': 16, 'min_samples_split': 0.04249551591587301, 'min_samples_leaf': 0.011101276891484742, 'max_features': 'log2'}. Best is trial 112 with value: 0.8630573920218263.
[I 2024-01-05 18:04:49,430] Trial 129 finished with value: 0.853473830378373 and parameters: {'n_estimators': 219, 'max_depth': 18, 'min_samples_split': 0.03650472538226935, 'min_samples_leaf': 0.03492221452215041, 'max_features': 'log2'}. Best is trial 112 with value: 0.8630573920218263.
[I 2024-01-05 18:05:19,685] Trial 130 finished with value: 0.8511086093196572 and parameters: {'n_estimators': 171, 'max_depth': 15, 'min_samples_split': 0.13603460592399003, 'min_samples_leaf': 0.02795321880210442, 'max_features': 'log2'}. Best is trial 112 with value: 0.8630573920218263.
[I 2024-01-05 18:06:11,200] Trial 131 finished with value: 0.8615373765292584 and parameters: {'n_estimators': 208, 'max_depth': 16, 'min_samples_split': 0.04214192449260257, 'min_samples_leaf': 0.01046180446777912, 'max_features': 'log2'}. Best is trial 112 with value: 0.8630573920218263.
[I 2024-01-05 18:06:55,915] Trial 132 finished with value: 0.8567882164750094 and parameters: {'n_estimators': 186, 'max_depth': 16, 'min_samples_split': 0.04098633288985625, 'min_samples_leaf': 0.01835422692255142, 'max_features': 'log2'}. Best is trial 112 with value: 0.8630573920218263.
[I 2024-01-05 18:07:33,170] Trial 133 finished with value: 0.8620090408740542 and parameters: {'n_estimators': 146, 'max_depth': 19, 'min_samples_split': 0.03456187321489605, 'min_samples_leaf': 0.010922291570331418, 'max_features': 'log2'}. Best is trial 112 with value: 0.8630573920218263.
[I 2024-01-05 18:08:20,384] Trial 134 finished with value: 0.8560211677910614 and parameters: {'n_estimators': 203, 'max_depth': 19, 'min_samples_split': 0.03391638515275963, 'min_samples_leaf': 0.021844833593308896, 'max_features': 'log2'}. Best is trial 112 with value: 0.8630573920218263.
[I 2024-01-05 18:08:58,189] Trial 135 finished with value: 0.861023265068096 and parameters: {'n_estimators': 158, 'max_depth': 17, 'min_samples_split': 0.048466748190465016, 'min_samples_leaf': 0.010430208020407344, 'max_features': 'log2'}. Best is trial 112 with value: 0.8630573920218263.
[I 2024-01-05 18:09:33,356] Trial 136 finished with value: 0.8613265000512891 and parameters: {'n_estimators': 146, 'max_depth': 17, 'min_samples_split': 0.04673819668172354, 'min_samples_leaf': 0.010589416977814353, 'max_features': 'log2'}. Best is trial 112 with value: 0.8630573920218263.
[I 2024-01-05 18:10:06,678] Trial 137 finished with value: 0.856804517381655 and parameters: {'n_estimators': 142, 'max_depth': 17, 'min_samples_split': 0.04332897918117962, 'min_samples_leaf': 0.02076270517977418, 'max_features': 'log2'}. Best is trial 112 with value: 0.8630573920218263.
[I 2024-01-05 18:10:43,271] Trial 138 finished with value: 0.8625076090914219 and parameters: {'n_estimators': 141, 'max_depth': 18, 'min_samples_split': 0.03273322570393787, 'min_samples_leaf': 0.010038944474860624, 'max_features': 'log2'}. Best is trial 112 with value: 0.8630573920218263.
[I 2024-01-05 18:11:15,606] Trial 139 finished with value: 0.8559191366038628 and parameters: {'n_estimators': 146, 'max_depth': 18, 'min_samples_split': 0.037250251864143824, 'min_samples_leaf': 0.026740997533756798, 'max_features': 'log2'}. Best is trial 112 with value: 0.8630573920218263.
[I 2024-01-05 18:11:44,552] Trial 140 finished with value: 0.8566720043926945 and parameters: {'n_estimators': 122, 'max_depth': 19, 'min_samples_split': 0.03266564518540453, 'min_samples_leaf': 0.02068859769458193, 'max_features': 'log2'}. Best is trial 112 with value: 0.8630573920218263.
[I 2024-01-05 18:12:18,279] Trial 141 finished with value: 0.8610925392407079 and parameters: {'n_estimators': 139, 'max_depth': 17, 'min_samples_split': 0.047497196929917274, 'min_samples_leaf': 0.010753678960107009, 'max_features': 'log2'}. Best is trial 112 with value: 0.8630573920218263.
[I 2024-01-05 18:13:00,142] Trial 142 finished with value: 0.8632902223707207 and parameters: {'n_estimators': 156, 'max_depth': 17, 'min_samples_split': 0.025873714643833402, 'min_samples_leaf': 0.010609397093618975, 'max_features': 'log2'}. Best is trial 142 with value: 0.8632902223707207.
[I 2024-01-05 18:13:14,729] Trial 143 finished with value: 0.829601577851004 and parameters: {'n_estimators': 149, 'max_depth': 17, 'min_samples_split': 0.02702968219225548, 'min_samples_leaf': 0.21660722775106736, 'max_features': 'log2'}. Best is trial 142 with value: 0.8632902223707207.
[I 2024-01-05 18:13:45,803] Trial 144 finished with value: 0.857016407272609 and parameters: {'n_estimators': 132, 'max_depth': 20, 'min_samples_split': 0.047501380663051304, 'min_samples_leaf': 0.016180967842323746, 'max_features': 'log2'}. Best is trial 142 with value: 0.8632902223707207.
[I 2024-01-05 18:14:26,752] Trial 145 finished with value: 0.8618723699816557 and parameters: {'n_estimators': 162, 'max_depth': 21, 'min_samples_split': 0.04108196784136851, 'min_samples_leaf': 0.01006722687927012, 'max_features': 'log2'}. Best is trial 142 with value: 0.8632902223707207.
[I 2024-01-05 18:14:52,997] Trial 146 finished with value: 0.8563989851317778 and parameters: {'n_estimators': 112, 'max_depth': 16, 'min_samples_split': 0.04067227851380699, 'min_samples_leaf': 0.021590625060563123, 'max_features': 'log2'}. Best is trial 142 with value: 0.8632902223707207.
[I 2024-01-05 18:15:29,546] Trial 147 finished with value: 0.8542760831886012 and parameters: {'n_estimators': 173, 'max_depth': 22, 'min_samples_split': 0.024181130814607467, 'min_samples_leaf': 0.03127375681512387, 'max_features': 'log2'}. Best is trial 142 with value: 0.8632902223707207.
[I 2024-01-05 18:16:10,563] Trial 148 finished with value: 0.8584315700345186 and parameters: {'n_estimators': 163, 'max_depth': 19, 'min_samples_split': 0.03055101767318684, 'min_samples_leaf': 0.015369309175387445, 'max_features': 'log2'}. Best is trial 142 with value: 0.8632902223707207.
[I 2024-01-05 18:16:45,788] Trial 149 finished with value: 0.8617640017495752 and parameters: {'n_estimators': 138, 'max_depth': 18, 'min_samples_split': 0.03644868824610628, 'min_samples_leaf': 0.010747821809061359, 'max_features': 'log2'}. Best is trial 142 with value: 0.8632902223707207.
